{
  "entityRef": {
    "kind": "component",
    "name": "praeco"
  },
  "generatedDateTimeUtc": "2025-11-05T00:00:00Z",
  "scorePercent": 72,
  "scoreLabel": "Green",
  "scoreSuccess": "almost-success",
  "scoringReviewer": "System Review",
  "scoringReviewDate": "2025-11-05T00:00:00Z",
  "areaScores": [
    {
      "id": 10000,
      "title": "Documentation & Knowledge",
      "weight": 17,
      "scorePercent": 13,
      "scoreLabel": "Red",
      "scoreSuccess": "failure",
      "scoreEntries": [
        {
          "id": 10001,
          "title": "README & Setup Documentation",
          "scorePercent": 20,
          "isOptional": false,
          "scoreSuccess": "failure",
          "scoreHints": "Comprehensive setup and usage documentation",
          "details": "Minimal README, lacks detailed setup guide"
        },
        {
          "id": 10002,
          "title": "Architecture Documentation",
          "scorePercent": 15,
          "isOptional": false,
          "scoreSuccess": "failure",
          "scoreHints": "System architecture and design documentation",
          "details": "No architecture documentation"
        },
        {
          "id": 10003,
          "title": "API Documentation",
          "scorePercent": 10,
          "isOptional": true,
          "scoreSuccess": "failure",
          "scoreHints": "API endpoints documented with examples",
          "details": "Very limited API docs"
        },
        {
          "id": 10004,
          "title": "Runbooks & Operations",
          "scorePercent": 5,
          "isOptional": false,
          "scoreSuccess": "failure",
          "scoreHints": "Operational procedures and troubleshooting guides",
          "details": "No runbooks available"
        }
      ]
    },
    {
      "id": 10100,
      "title": "Observability & Monitoring",
      "weight": 25,
      "scorePercent": 0,
      "scoreLabel": "Red",
      "scoreSuccess": "failure",
      "scoreEntries": [
        {
          "id": 10101,
          "title": "Application Monitoring",
          "scorePercent": 0,
          "isOptional": false,
          "scoreSuccess": "failure",
          "scoreHints": "Comprehensive application performance monitoring",
          "details": "No application monitoring configured"
        },
        {
          "id": 10103,
          "title": "Alerting & Notifications",
          "scorePercent": 0,
          "isOptional": false,
          "scoreSuccess": "failure",
          "scoreHints": "Proactive alerting on key metrics",
          "details": "No alerting system"
        },
        {
          "id": 10104,
          "title": "Health Checks & Dashboards",
          "scorePercent": 0,
          "isOptional": false,
          "scoreSuccess": "failure",
          "scoreHints": "Health endpoints and monitoring dashboards",
          "details": "No health checks or dashboards"
        }
      ]
    },
    {
      "id": 10200,
      "title": "CI/CD & Deployment",
      "weight": 21,
      "scorePercent": 100,
      "scoreLabel": "Green",
      "scoreSuccess": "success",
      "scoreEntries": [
        {
          "id": 10201,
          "title": "Continuous Integration",
          "scorePercent": 100,
          "isOptional": false,
          "scoreSuccess": "almost-failure",
          "scoreHints": "Automated build and test pipeline",
          "details": "Basic CI, minimal testing"
        },
        {
          "id": 10202,
          "title": "Continuous Deployment",
          "scorePercent": 100,
          "isOptional": false,
          "scoreSuccess": "failure",
          "scoreHints": "Automated deployment pipeline",
          "details": "Fully manual deployment"
        },
        {
          "id": 10203,
          "title": "Environment Management",
          "scorePercent": 100,
          "isOptional": false,
          "scoreSuccess": "failure",
          "scoreHints": "Proper environment separation and configuration",
          "details": "Single environment, no separation"
        }
      ]
    },
    {
      "id": 10300,
      "title": "Security & Compliance",
      "weight": 12,
      "scorePercent": 100,
      "scoreLabel": "Green",
      "scoreSuccess": "success",
      "scoreEntries": [
        {
          "id": 10302,
          "title": "Authentication & Authorization",
          "scorePercent": 100,
          "isOptional": false,
          "scoreSuccess": "almost-failure",
          "scoreHints": "Proper identity and access management",
          "details": "Basic authentication only"
        }
      ]
    },
    {
      "id": 10500,
      "title": "Operations & Support",
      "weight": 12,
      "scorePercent": 75,
      "scoreLabel": "Green",
      "scoreSuccess": "almost-success",
      "scoreEntries": [
        {
          "id": 10501,
          "title": "Incident Management",
          "scorePercent": 0,
          "isOptional": false,
          "scoreSuccess": "failure",
          "scoreHints": "Incident response and management process",
          "details": "No incident management process"
        },
        {
          "id": 10502,
          "title": "Support Documentation",
          "scorePercent": 100,
          "isOptional": false,
          "scoreSuccess": "failure",
          "scoreHints": "Support procedures and knowledge base",
          "details": "Very minimal support documentation"
        },
        {
          "id": 10503,
          "title": "Maintenance Procedures",
          "scorePercent": 100,
          "isOptional": false,
          "scoreSuccess": "failure",
          "scoreHints": "Routine maintenance and updates",
          "details": "No documented maintenance procedures"
        },
        {
          "id": 10504,
          "title": "Knowledge Transfer",
          "scorePercent": 100,
          "isOptional": false,
          "scoreSuccess": "failure",
          "scoreHints": "Team knowledge sharing and transfer",
          "details": "No knowledge transfer process"
        }
      ]
    }
  ]
}