
{
  "entityRef": {
    "kind": "component",
    "name": "odoo-sales"
  },
  "generatedDateTimeUtc": "2021-07-22 10:00",
  "scorePercent": 36,
  "scoreLabel": "Yellow",
  "scoreSuccess": "almost-failure",
  "scoringReviewer": "Guest",
  "scoringReviewDate": "2022-01-04T08:00:00Z",
  "areaScores": [
    {
      "id": 2199,
      "title": "Quality",
      "scorePercent": 90,
      "scoreLabel": "Green",
      "scoreSuccess": "success",
      "scoreEntries": [
        {
          "id": 2157,
          "title": "Code Coverage",
          "scorePercent": 33.1,
          "scoreLabel": "C",
          "scoreSuccess": "almost-failure",
          "scoreHints": "Code coverage: 33.1%",
          "details": "Target is 50% coverage, current is 33.1%"
        }
      ]
    },
    {
      "id": 3937,
      "title": "Reliability",
      "scorePercent": 30,
      "scoreLabel": "Red",
      "scoreSuccess": "failure",
      "scoreEntries": [
        {
          "id": 3938,
          "title": "Feature Flagging",
          "scorePercent": 0,
          "scoreSuccess": "failure",
          "scoreHints": "Feature flagging is not implemented for any production features.",
          "details": "One POC Feature flag is required for success"
        },
        {
          "id": 3940,
          "title": "Automated rollbacks",
          "isOptional": false,
          "scorePercent": 0,
          "scoreSuccess": "failure",
          "scoreHints": "Not started",
          "details": "Ability to automatically rollback failed deployments"
        },
        {
          "id": 2207,
          "title": "Post Deployment Validation",
          "scoreSuccess": "failure",
          "scorePercent": 10,
          "details": "We need to have a step in our deployment pipeline that validates the deployment was successful."
        }
      ]
    },
    {
      "id": 2208,
      "title": "Monitoring",
      "scorePercent": 50,
      "scoreLabel": "Yellow",
      "scoreSuccess": "almost-failure",
      "scoreEntries": [
        {
          "id": 2210,
          "title": "Performance monitoring",
          "scorePercent": 70,
          "scoreSuccess": "almost-success",
          "details": "Monitor the service performance metrics such as response times, throughput, and resource utilization."
        },
        {
          "id": 2185,
          "title": "Preventive Alerting",
          "scorePercent": 0,
          "scoreSuccess": "unknown",
          "details": "Monitor metrics that can indicate potential issues before they impact users, such as increased error rates or latency."
        }
      ]
    }
  ]
}
