
{
  "entityRef": {
    "kind": "component",
    "name": "couchbase"
  },
  "generatedDateTimeUtc": "2021-07-22 10:00",
  "scorePercent": 58.3,
  "scoreLabel": "Yellow",
  "scoreSuccess": "almost-failure",
  "scoringReviewer": "Guest",
  "scoringReviewDate": "2022-01-04T08:00:00Z",
  "areaScores": [
    {
      "id": 3937,
      "title": "Documentation",
      "scorePercent": 30,
      "scoreLabel": "Red",
      "scoreSuccess": "failure",
      "scoreEntries": [
        {
          "id": 3938,
          "title": "Project introduction",
          "scorePercent": 100,
          "scoreSuccess": "success",
          "scoreHints": "Well structured/documented/linked with the wiki: 100%",
          "details": "Project home page is linked to **devops wiki**."
        },
        {
          "id": 3940,
          "title": "Project wiki",
          "isOptional": false,
          "scorePercent": 50,
          "scoreSuccess": "partial",
          "scoreHints": "Somewhat usefull: 50%",
          "details": "Project wiki contains basic information however it is not well structured. It contains brief introduction and few pages about the technology used, but it is missing business context, processes description etc."
        },
        {
          "id": 2207,
          "title": "README",
          "scoreSuccess": "unknown",
          "scorePercent": 30,
          "details": "..."
        },
        {
          "id": 2170,
          "title": "RFP",
          "scoreSuccess": "unknown",
          "details": "..."
        },
        {
          "id": 2164,
          "title": "Architecture Diagrams",
          "scoreSuccess": "unknown",
          "details": "..."
        },
        {
          "id": 2205,
          "title": "SLA",
          "scorePercent": 40,
          "scoreSuccess": "unknown",
          "details": "..."
        },
        {
          "id": 2165,
          "title": "Business Documentation",
          "scorePercent": 0,
          "scoreSuccess": "unknown",
          "details": "..."
        },
        {
          "id": 2171,
          "title": "Road Map",
          "scorePercent": 0,
          "scoreSuccess": "unknown",
          "details": "..."
        }
      ]
    },
    {
      "id": 2208,
      "title": "Operations",
      "scorePercent": 50,
      "scoreLabel": "Yellow",
      "scoreSuccess": "almost-failure",
      "scoreEntries": [
        {
          "id": 2210,
          "title": "Health Checks",
          "scorePercent": 0,
          "scoreSuccess": "failure",
          "details": "Completelly missing healthchecks."
        },
        {
          "id": 2185,
          "title": "Semantic Versioning",
          "scorePercent": 0,
          "scoreSuccess": "unknown",
          "details": "..."
        },
        {
          "id": 2176,
          "title": "CI Pipelines",
          "scorePercent": 0,
          "scoreSuccess": "unknown",
          "details": "..."
        },
        {
          "id": 2175,
          "title": "CD Pipelines",
          "scorePercent": 0,
          "scoreSuccess": "unknown",
          "details": "..."
        },
        {
          "id": 2181,
          "title": "Insights Dashboard",
          "scorePercent": 0,
          "scoreSuccess": "unknown",
          "details": "..."
        },
        {
          "id": 2173,
          "title": "Alerts",
          "scorePercent": 0,
          "scoreSuccess": "unknown",
          "details": "..."
        },
        {
          "id": 2184,
          "title": "Release-Notes",
          "scorePercent": 0,
          "scoreSuccess": "unknown",
          "details": "..."
        },
        {
          "id": 2183,
          "title": "Release-Annotations-to-App-Insights",
          "scorePercent": 0,
          "scoreSuccess": "unknown",
          "details": "..."
        },
        {
          "id": 2178,
          "title": "DNS Record",
          "isOptional": true,
          "scorePercent": 0,
          "scoreSuccess": "unknown",
          "details": "..."
        },
        {
          "id": 2180,
          "title": "GitOps",
          "scorePercent": 0,
          "scoreSuccess": "unknown",
          "details": "..."
        },
        {
          "id": 2177,
          "title": "Canary-Checks",
          "isOptional": true,
          "scorePercent": 0,
          "scoreSuccess": "unknown",
          "details": "...depends on tier/SLA..."
        },
        {
          "id": 2172,
          "title": "AB Testing",
          "isOptional": true,
          "scorePercent": 10,
          "scoreSuccess": "unknown",
          "details": "..."
        },
        {
          "id": 3941,
          "title": "Disaster Recovery Plan",
          "scorePercent": 10,
          "scoreSuccess": "unknown",
          "details": "..."
        },
        {
          "id": 2179,
          "title": "Data Refresh For Testing Environments",
          "scorePercent": 10,
          "scoreSuccess": "unknown",
          "details": "..."
        },
        {
          "id": 2174,
          "title": "Basic Ops Handed Over to L2",
          "scorePercent": 10,
          "scoreSuccess": "unknown",
          "details": "..."
        }
      ]
    },
    {
      "id": 4333,
      "title": "Quality",
      "scorePercent": 25,
      "scoreLabel": "Red",
      "scoreSuccess": "failure",
      "scoreEntries": [
        {
          "id": 2187,
          "title": "Code Reviews",
          "scorePercent": 100,
          "scoreSuccess": "success",
          "scoreHints": [
            "PR requires reviewer",
            "No override possible",
            "PRs are well described",
            "PRs are small",
            "PRs has comments"
          ],
          "details": "Development policy is defined. Code review process is done during the pull request with minimum of 2 reviewers."
        },
        {
          "id": 2191,
          "title": "Unit Tests",
          "scorePercent": 10,
          "scoreSuccess": "unknown",
          "details": "..."
        },
        {
          "id": 2189,
          "title": "Integration Tests",
          "scorePercent": 0,
          "scoreSuccess": "unknown",
          "details": "..."
        },
        {
          "id": 2190,
          "title": "Performance Tests",
          "scorePercent": 10,
          "scoreSuccess": "unknown",
          "details": "..."
        },
        {
          "id": 2186,
          "title": "Automation Tests",
          "scorePercent": 10,
          "scoreSuccess": "unknown",
          "details": "..."
        },
        {
          "id": 2188,
          "title": "Design Reviews",
          "scorePercent": 10,
          "scoreSuccess": "unknown",
          "details": "..."
        }
      ]
    }
  ]
}
